{
  "$schema": "https://json-schema.org/draft/2020-12/schema",
  "$id": "https://zodiac.local/contracts/render-plan-v1.schema.json",
  "type": "object",
  "required": [
    "format",
    "fps",
    "video",
    "assets",
    "scenes"
  ],
  "additionalProperties": false,
  "$defs": {
    "event": {
      "type": "object",
      "required": [
        "event_id",
        "scene_id",
        "target",
        "start_frame",
        "end_frame",
        "state_before",
        "state_after",
        "motion",
        "asset_before",
        "asset_after"
      ],
      "additionalProperties": false,
      "properties": {
        "event_id": {
          "type": "string",
          "minLength": 1
        },
        "scene_id": {
          "type": "string",
          "minLength": 1
        },
        "target": {
          "type": "string",
          "minLength": 1
        },
        "start_frame": {
          "type": "integer",
          "minimum": 0
        },
        "end_frame": {
          "type": "integer",
          "minimum": 1
        },
        "preferred_start_frame": {
          "type": "integer",
          "minimum": 0
        },
        "state_before": {
          "type": "string",
          "minLength": 1
        },
        "state_after": {
          "type": "string",
          "minLength": 1
        },
        "motion": {
          "type": "string",
          "minLength": 1
        },
        "merged_event_ids": {
          "type": "array",
          "minItems": 2,
          "items": {
            "type": "string",
            "minLength": 1
          }
        },
        "asset_before": {
          "type": "string",
          "minLength": 1
        },
        "asset_after": {
          "type": "string",
          "minLength": 1
        }
      }
    },
    "scene": {
      "type": "object",
      "required": [
        "id",
        "start_frame",
        "duration_frames",
        "events"
      ],
      "additionalProperties": false,
      "properties": {
        "id": {
          "type": "string",
          "minLength": 1
        },
        "continuity_group": {
          "type": "string",
          "minLength": 1
        },
        "performance_context_hash": {
          "type": "string",
          "pattern": "^[0-9a-f]{64}$"
        },
        "start_frame": {
          "type": "integer",
          "minimum": 0
        },
        "duration_frames": {
          "type": "integer",
          "minimum": 1
        },
        "events": {
          "type": "array",
          "items": {
            "$ref": "#/$defs/event"
          }
        },
        "measured_duration_frames": {
          "type": "integer",
          "minimum": 1
        },
        "entities": {
          "type": "array",
          "items": {
            "$ref": "#/$defs/entity"
          }
        },
        "captions": {
          "type": "array",
          "items": {
            "$ref": "#/$defs/caption"
          }
        },
        "layout_contract": {
          "$ref": "#/$defs/layout_contract"
        },
        "render_density_budget": {
          "type": "object",
          "additionalProperties": false,
          "required": [
            "max_characters",
            "max_prominent_props",
            "max_prominent_effects"
          ],
          "properties": {
            "max_characters": {
              "type": "integer",
              "minimum": 1,
              "maximum": 3
            },
            "max_prominent_props": {
              "type": "integer",
              "minimum": 0,
              "maximum": 2
            },
            "max_prominent_effects": {
              "type": "integer",
              "minimum": 0,
              "maximum": 2
            }
          }
        },
        "spatial_bindings": {
          "type": "array",
          "items": {
            "$ref": "#/$defs/spatial_binding"
          }
        },
        "occlusion_relations": {
          "type": "array",
          "items": {
            "type": "object",
            "additionalProperties": false,
            "required": [
              "front",
              "back"
            ],
            "properties": {
              "front": {
                "type": "string",
                "minLength": 1
              },
              "back": {
                "type": "string",
                "minLength": 1
              }
            }
          }
        }
      }
    },
    "state": {
      "type": "object",
      "required": [
        "asset"
      ],
      "additionalProperties": true,
      "properties": {
        "asset": {
          "type": "string",
          "minLength": 1
        },
        "transform": {
          "type": "object",
          "additionalProperties": true
        },
        "layer": {
          "type": "integer"
        },
        "visible": {
          "type": "boolean"
        }
      }
    },
    "entity": {
      "type": "object",
      "required": [
        "id",
        "initial_state",
        "states"
      ],
      "additionalProperties": false,
      "properties": {
        "id": {
          "type": "string",
          "minLength": 1
        },
        "initial_state": {
          "type": "string",
          "minLength": 1
        },
        "states": {
          "type": "object",
          "additionalProperties": {
            "$ref": "#/$defs/state"
          }
        },
        "kind": {
          "type": "string",
          "minLength": 1
        },
        "visual_role": {
          "enum": [
            "background",
            "character",
            "interactive_prop",
            "foreground_environment",
            "story_object",
            "story_symbol",
            "effect",
            "caption",
            "overlay"
          ]
        },
        "role": {
          "type": "string",
          "minLength": 1
        },
        "layer": {
          "type": "integer"
        }
      }
    },
    "caption": {
      "type": "object",
      "required": [
        "text",
        "start_frame",
        "end_frame"
      ],
      "additionalProperties": false,
      "properties": {
        "words": {
          "type": "array",
          "minItems": 1,
          "items": {
            "type": "object",
            "additionalProperties": false,
            "required": [
              "text",
              "start_frame",
              "end_frame"
            ],
            "properties": {
              "text": {
                "type": "string",
                "minLength": 1
              },
              "start_frame": {
                "type": "number",
                "minimum": 0
              },
              "end_frame": {
                "type": "number",
                "exclusiveMinimum": 0
              }
            }
          }
        },
        "text": {
          "type": "string",
          "minLength": 1
        },
        "start_frame": {
          "type": "integer",
          "minimum": 0
        },
        "end_frame": {
          "type": "integer",
          "minimum": 1
        }
      }
    },
    "presentation": {
      "type": "object",
      "additionalProperties": true,
      "properties": {
        "paper": {
          "type": "string",
          "minLength": 1
        },
        "ink": {
          "type": "string",
          "minLength": 1
        },
        "caption": {
          "type": "object",
          "additionalProperties": true
        },
        "watermark": {
          "type": "object",
          "additionalProperties": true
        }
      }
    },
    "zone": {
      "type": "object",
      "additionalProperties": false,
      "required": [
        "x",
        "y",
        "width",
        "height"
      ],
      "properties": {
        "x": {
          "type": "integer",
          "minimum": 0
        },
        "y": {
          "type": "integer",
          "minimum": 0
        },
        "width": {
          "type": "integer",
          "minimum": 1
        },
        "height": {
          "type": "integer",
          "minimum": 1
        }
      }
    },
    "layout_contract": {
      "type": "object",
      "additionalProperties": false,
      "required": [
        "canvas",
        "caption_safe_zone",
        "character_zone",
        "prop_zone",
        "effect_zone"
      ],
      "properties": {
        "canvas": {
          "type": "object",
          "additionalProperties": false,
          "required": [
            "width",
            "height"
          ],
          "properties": {
            "width": {
              "type": "integer",
              "minimum": 1
            },
            "height": {
              "type": "integer",
              "minimum": 1
            }
          }
        },
        "caption_safe_zone": {
          "$ref": "#/$defs/zone"
        },
        "character_zone": {
          "$ref": "#/$defs/zone"
        },
        "prop_zone": {
          "$ref": "#/$defs/zone"
        },
        "effect_zone": {
          "$ref": "#/$defs/zone"
        }
      }
    },
    "spatial_binding": {
      "type": "object",
      "additionalProperties": false,
      "required": [
        "entity",
        "anchor",
        "relation"
      ],
      "properties": {
        "entity": {
          "type": "string",
          "minLength": 1
        },
        "anchor": {
          "type": "string",
          "minLength": 1
        },
        "relation": {
          "type": "string",
          "enum": [
            "near",
            "held_by",
            "on_surface",
            "emitted_by",
            "points_to"
          ]
        },
        "max_distance_px": {
          "type": "number",
          "exclusiveMinimum": 0,
          "maximum": 1200
        }
      }
    }
  },
  "properties": {
    "format": {
      "const": "zodiac-render-plan@1"
    },
    "fps": {
      "type": "integer",
      "minimum": 1,
      "maximum": 120
    },
    "video": {
      "type": "object",
      "required": [
        "width",
        "height"
      ],
      "additionalProperties": false,
      "properties": {
        "width": {
          "type": "integer",
          "minimum": 1
        },
        "height": {
          "type": "integer",
          "minimum": 1
        }
      }
    },
    "assets": {
      "type": "object",
      "additionalProperties": {
        "type": "object"
      }
    },
    "scenes": {
      "type": "array",
      "minItems": 1,
      "items": {
        "$ref": "#/$defs/scene"
      }
    },
    "presentation": {
      "$ref": "#/$defs/presentation"
    },
    "performance_context_hash": {
      "type": "string",
      "pattern": "^[0-9a-f]{64}$"
    }
  }
}
